{
  "decision_id": "did:feature-promotion-0001",
  "decision_type": "FEATURE_PROMOTION",
  "policy_id": "decision-world-signal-policy@0.1.0",
  "input_artifact_hashes": [
    "sha256:aaaaaaaaaaaaaaaaaaaaaaaaaaaaaaaaaaaaaaaaaaaaaaaaaaaaaaaaaaaaaaaa"
  ],
  "candidate_ids": [
    "gaia.weather.15_minute_forecast"
  ],
  "selected_id": "gaia.weather.15_minute_forecast",
  "selected_value": {
    "promotion_state": "contract_validated"
  },
  "rule_trace": [
    {
      "rule_id": "feature_requires_manifest",
      "outcome": "passed",
      "detail": "source manifest reference is present"
    },
    {
      "rule_id": "feature_requires_provenance_requirements",
      "outcome": "passed",
      "detail": "minimum provenance requirements are declared"
    }
  ],
  "confidence": 1.0,
  "responsible_actor": "actor:contract-reviewer",
  "created_at": "2026-05-06T00:00:00Z",
  "replay_instructions": "Re-validate the feature registry entry and decision policy version against the referenced input artifact hash.",
  "notes": "Example decision ledger entry for promoting a feature registry entry to contract-validated state."
}
